name,Images,Description,Location,Weekend,Weekday,Tag1,Tag2,link
Hin Bus Depot,"homepage/hinbus.jpg","Hin Bus Depot is a vibrant creative hub that transformed from an old bus depot into a dynamic space for contemporary art and cultural events. Known for its eclectic art exhibitions, community markets, and workshops, it blends Penang's heritage charm with modern creativity, making it a must-visit destination for art and culture enthusiasts.","31A, Jalan Gurdwara, 10300 George Town, Pulau Pinang.","11am - 5pm","12pm - 7pm",Vintage,Leisure,"https://www.google.com/maps/place/Hin+Bus+Depot/@5.3521612,100.2930176,14z/data=!4m6!3m5!1s0x304ac3956fabd50b:0xcb4ba1088ede4a34!8m2!3d5.4122027!4d100.3281352!16s%2Fg%2F11c5xs3w8d?entry=ttu&g_ep=EgoyMDI0MTIxMS4wIKXMDSoASAFQAw%3D%3D"
Ya Hong Art Gallery,"homepage/YaHong.png","Yahong Art Gallery attractively displays the original batik paintings of Chuah Thean Teng and his sons. Teng's works are avidly sought by both private collectors and museums throughout the world. Teng enjoys notability as the father and master of batik painting. He has transformed the ancient craft of batik into a fine art form. Although Chuah family's paintings occupy a prominent position in the gallery, Yahong also displays wide collection of arts & handicrafts that you will love bringing home! Yahong's engaging display of vivid art work will mesmerise the casual buyer as well as the serious art collectors","58 D, Jalan Batu Ferringhi, Kampung Batu Feringgi, 11100 Batu Ferringhi, Pulau Pinang","10am - 6pm","10am - 6pm, Sunday closed",Artistic,Cultural,"https://www.google.com/maps/place/Yahong+Art+Gallery/@5.470275,100.2431081,17z/data=!3m1!4b1!4m6!3m5!1s0x304ae8091c60d163:0x8757319312367526!8m2!3d5.470275!4d100.245683!16s%2Fg%2F1tfcqnvc?entry=ttu&g_ep=EgoyMDI0MTIxMS4wIKXMDSoASAFQAw%3D%3D"
Nguni Designs,"homepage/NguniDesigns.jpg","It's where you could find unique & fascinating genuine & authentic tribal arts (artefacts) from Borneo & South East Asia & also from many African countries to add to your collections. Or you could take home some animal hides/rugs from around the world, of which were obtained from sustainable sources & professionally tanned. None of our hides/rugs are protected/endangered. Do come & visit us!","38, Stewart Ln, Georgetown, 10200 George Town, Penang","10:30am - 9pm","10:30am - 9pm",Gift,antique,"https://www.google.com/maps/place/Nguni+Designs/@-22.5464703,27.1090474,17z/data=!3m1!4b1!4m6!3m5!1s0x1eb0d3892ae944c5:0x5f0c5858a79e1614!8m2!3d-22.5464703!4d27.1116223!16s%2Fg%2F11fxy5d33q?entry=ttu&g_ep=EgoyMDI0MTIxMS4wIKXMDSoASAFQAw%3D%3D"
The Art Gallery,"homepage/ArtGallery.jpg","The Art Gallery offers a rich insight into the culture and history of Malaysian Art. Exhibiting works completed by contemporary artist (such as Alex Leong, Calvin Chua, Ch'ng Kiah Kiean, Khoo Cheang Jin) as well as Pioneer Artists (such as Abdullah Ariff, Chuah Thean Teng, Khaw Sia, Kuo Ju Ping and Yong Mun Sen). The Art Gallery aptly showcases the renaissance of Malaysian art for the past 30 years.","368-4-8, Bellisa Row, Jalan Burma, Pulau Tikus, 10350 George Town, Pulau Pinang","Closed, Friday: 2pm - 5:30pm","2pm - 5:30pm",Aesthetic,Captivating,"https://www.google.com/maps/place/The+Art+Gallery,+Penang+(Open+by+Appointments+Only)/@5.4328379,100.3074601,17z/data=!3m1!4b1!4m6!3m5!1s0x304ac300cec24a97:0x5e3983c9a0567798!8m2!3d5.4328379!4d100.310035!16s%2Fg%2F11b7w869l3?entry=ttu&g_ep=EgoyMDI0MTIxMS4wIKXMDSoASAFQAw%3D%3D"
The Star Pitt Street,"homepage/StarPittStreet.jpg","The Star Pitt Street, located in George Town, Penang, is a beautifully restored colonial building that once housed The Star newspaper's offices. Today, it serves as a cultural hub, hosting exhibitions, workshops, and events that celebrate Penang's rich history, diverse culture, and thriving arts scene. This iconic space blends heritage with creativity, making it a must-visit destination for art and history enthusiasts.","15, Jln Masjid Kapitan Keling, George Town, 10200 George Town, Pulau Pinang","9am - 5:30pm",Closed,Historic,Picturesque,"https://www.google.com/maps/place/The+Star+Pitt+St.+(Star+Media+Group+Berhad)/@5.4187584,100.3366422,17z/data=!3m1!4b1!4m6!3m5!1s0x304ac38fdd23134f:0x3bb6b88f1e5d0f59!8m2!3d5.4187584!4d100.3392171!16s%2Fg%2F11bwh5rz1t?entry=ttu&g_ep=EgoyMDI0MTIxMS4wIKXMDSoASAFQAw%3D%3D"
Ming Fine Art Gallery,"homepage/MingArt.jpg","Ming Fine Art Gallery is a contemporary art space in Penang, showcasing an impressive collection of traditional and modern artworks. With its refined and elegant ambiance, it offers visitors a unique experience of both local and international artistic expressions.","20, Stewart Ln, Georgetown, 10200 George Town, Penang","10am - 6pm","10am - 6pm",Stylish,Vibrant,"https://www.google.com/maps/place/Ming+Fine+Art/@5.4191609,100.3353208,17z/data=!3m1!4b1!4m6!3m5!1s0x304ac33b76e11459:0x65ed4f8bf16ce567!8m2!3d5.4191609!4d100.3378957!16s%2Fg%2F11ghpsd5yt?entry=ttu&g_ep=EgoyMDI0MTIxMS4wIKXMDSoASAFQAw%3D%3D"
Galeri Seni Mutiara,"homepage/GaleriSeniMutiara.jpg","Galeri Seni Mutiara is a vibrant art gallery located in Penang, showcasing a diverse collection of contemporary and traditional artworks. It serves as a platform for both established and emerging artists, offering visitors a chance to experience the rich cultural heritage and artistic expression of the region. The gallery is known for its intimate atmosphere and carefully curated exhibitions, making it a must-visit destination for art enthusiasts.","31-12-16, Lebuh Nipah 5, Bukit Jambul, 11900 Bayan Lepas, Pulau Pinang","11am - 5pm","11am - 5pm",Eclectic,Creative,"https://www.google.com/maps/place/Galeri+Seni+Mutiara/@5.3366208,100.2899395,17z/data=!3m1!4b1!4m6!3m5!1s0x304ac3918b82bf17:0x6f6418f66452a640!8m2!3d5.3366208!4d100.2925144!16s%2Fg%2F11btsvfjxp?entry=ttu&g_ep=EgoyMDI0MTIxMS4wIKXMDSoASAFQAw%3D%3D"
China House,"homepage/ChinaHouse.jpg","China House is a unique, multi-concept venue located in the heart of George Town. It blends art, food, and culture in an inviting atmosphere. Housed in a heritage building, the space features a café, bakery, restaurant, and art gallery, offering a delightful experience for both art lovers and food enthusiasts. Its relaxed ambiance, combined with creative works and diverse culinary offerings, makes China House a must-visit destination for anyone seeking a mix of history, culture, and modern flair.","153, Beach St, Georgetown, 10300 George Town, Penang","9am - 1am","9am - 1am",Culinary,Leisure,"https://www.google.com/maps/place/ChinaHouse/@5.4148199,100.3362131,17z/data=!3m1!4b1!4m6!3m5!1s0x304ac38df8f8b6d3:0xa5f2665d05a3f04!8m2!3d5.4148199!4d100.338788!16s%2Fg%2F1hhgx_2wm?entry=ttu&g_ep=EgoyMDI0MTIxMS4wIKXMDSoASAFQAw%3D%3D"
Art Lane,"homepage/artlane.png","Art Lane is a vibrant and contemporary art space located in the heart of Penang. Known for its creative atmosphere, it showcases an array of works by local and international artists. The gallery features a diverse collection of paintings, sculptures, and installations, making it a hub for art enthusiasts and collectors. With its dynamic exhibitions and community events, Art Lane fosters a creative environment that celebrates artistic expression and cultural exchange.","127, Beach St, Georgetown, 10450 George Town, Penang","11am - 7pm","11am - 7pm",Artistic,Colorful,"https://www.google.com/maps/place/Artlane/@5.4151242,100.3366287,17z/data=!3m1!4b1!4m6!3m5!1s0x304ac353a3ea269b:0x17720c200d7ed444!8m2!3d5.4151242!4d100.3392036!16s%2Fg%2F11s93nd2d5?entry=ttu&g_ep=EgoyMDI0MTIxMS4wIKXMDSoASAFQAw%3D%3D"