name,Images,Description,Location,Weekend,Weekday,Tag1,Tag2,link
Syed Mustafa Wali Mausoleum,"homepage/SyedMausoleum.jpg","The Syed Mustafa Wali Mausoleum is a significant cultural and religious landmark in Penang, Malaysia, that embodies centuries of Islamic heritage. Dedicated to Syed Mustafa Wali, a revered scholar and spiritual leader, this mausoleum reflects the deep respect and devotion of the local community. The site features intricately carved Islamic motifs, blending traditional craftsmanship with serene architecture that evokes a sense of peace and spirituality. Visitors are captivated by the tranquil atmosphere and the rich stories surrounding Syed Mustafa Wali's contributions to Islamic teachings and the local community. Besides being a site of pilgrimage, the mausoleum also stands as a testament to Penang's multi-religious history, drawing tourists and history enthusiasts alike. Its picturesque surroundings and historical significance make it a must-visit destination for those eager to explore Penang's diverse cultural tapestry.","Al Haram, 6628, Saudi Arabia, Madinah 42311, Saudi Arabia",8:00 AM - 6:00 PM,8:30 AM - 5:30 PM,Heritage,Religious,"https://www.google.com/maps/place/Hazrat+Syed+Mohammad+Mustafa+Sallallahu+Alaihi+Wasallam/@24.4676832,39.6089161,17z/data=!3m1!4b1!4m6!3m5!1s0x15bdbfc31dc3e955:0x83d811c72cf61720!8m2!3d24.4676783!4d39.611491!16s%2Fg%2F11j5v750gr?entry=ttu&g_ep=EgoyMDI0MTIxMS4wIKXMDSoASAFQAw%3D%3D"
Syed Hussein Mausoleum,"homepage/SyedHussein.jpg","The Syed Hussein Mausoleum is a historic and spiritual site that holds immense significance for the local Muslim community in Penang. This mausoleum is dedicated to Syed Hussein, an esteemed figure celebrated for his contributions to Islamic teachings and his role as a spiritual guide in the region. Surrounded by lush greenery and a peaceful ambiance, the mausoleum is a place for quiet reflection and reverence. Its simple yet elegant design features traditional Islamic architectural elements, including domes and arches that symbolize eternity and spiritual connection. The mausoleum serves as a reminder of the enduring legacy of Syed Hussein and is a popular site for both religious pilgrims and history enthusiasts. Its historical and cultural relevance makes it a cherished landmark in Penang, inviting visitors to explore its serene surroundings and delve into the rich tapestry of the island's spiritual heritage.","Aceh Street Mosque, George Town, 10450 George Town, Pulau Pinang",8:00 AM - 6:00 PM,8:30 AM - 5:30 PM,Heritage,Religious,"https://www.google.com/maps/place/Saddam+Hussein's+grave/@34.5298306,43.7018122,17z/data=!3m1!4b1!4m6!3m5!1s0x15514f00414f5e41:0x6e5055f54ea24345!8m2!3d34.5298262!4d43.7043871!16s%2Fg%2F11wn_55xkp?entry=ttu&g_ep=EgoyMDI0MTIxMS4wIKXMDSoASAFQAw%3D%3D"
Protestant Cemetery,"homepage/ProtestantCemetery.jpg","The Protestant Cemetery in Penang is one of the oldest Christian burial grounds in Malaysia, dating back to the late 18th century. Located in George Town, this cemetery serves as the final resting place for some of Penang's most notable early settlers, including Francis Light, the founder of Penang. The cemetery is a serene and historic site, with gravestones and tombs that reflect a blend of European and local influences in their designs. Many of the tombstones feature intricate carvings and epitaphs, offering a glimpse into the lives and beliefs of the colonial era. Surrounded by tall trees and shaded paths, the cemetery provides a tranquil environment for reflection. It is not only a place of remembrance but also an invaluable source of history, showcasing the multicultural fabric of Penang during its early days. Visitors often find themselves captivated by the stories etched in stone and the sense of timelessness that permeates the grounds.","Jalan Sultan Ahmad Shah, 10050 George Town, Penang, MALAYSIA",8:00 AM - 6:00 PM,8:30 AM - 5:30 PM,Heritage,Historical,"https://www.google.com/maps/place/Protestant+Cemetery/@5.4231128,100.3281184,17z/data=!3m1!4b1!4m6!3m5!1s0x304ac39a2be14d9f:0xd8daa5e0d5fa8de!8m2!3d5.4231075!4d100.3329893!16s%2Fm%2F05v1g8v?entry=ttu&g_ep=EgoyMDI0MTIxMS4wIKXMDSoASAFQAw%3D%3D"
Noordin Family Mausoleum,"homepage/NoordinFamily.jpg","The Noordin Family Mausoleum is a significant historical and architectural landmark in Penang. This beautifully preserved structure stands as a testament to the prominence of the Noordin family, who were influential figures in the development of Penang during the 19th century. The mausoleum, located in George Town, is a fine example of Islamic funerary architecture, featuring intricate carvings, traditional motifs, and a serene atmosphere. The site reflects the cultural and historical heritage of Penang's Muslim community and offers visitors a glimpse into the rich legacy of one of the region's most notable families. Surrounded by lush greenery, the mausoleum is both a tranquil space for reflection and an important historical site that underscores the multicultural fabric of Penang. It continues to be a place of reverence and remembrance for locals and visitors alike.","92, Jln Masjid Kapitan Keling, George Town, 10200 George Town, Pulau Pinang",8:00 AM - 6:00 PM,8:30 AM - 5:30 PM,Heritage,Historical,"https://www.google.com/maps/place/Noordin+Family+Mausoleum/@5.416997,100.3349205,17z/data=!3m1!4b1!4m6!3m5!1s0x304ac3fb127303b5:0xc01c394fd1a7115a!8m2!3d5.4169917!4d100.3374954!16s%2Fg%2F11hzxrspjg?entry=ttu&g_ep=EgoyMDI0MTIxMS4wIKXMDSoASAFQAw%3D%3D"
Kapitan Keling Family Mausoleum,"homepage/KapitanKeling.jpg","The Kapitan Keling Family Mausoleum is a historical site in George Town, Penang, commemorating the legacy of the Kapitan Keling, an esteemed leader of the Indian Muslim community during the 18th century. This mausoleum, located near the iconic Kapitan Keling Mosque, is an enduring symbol of the cultural and historical contributions of Penang's Indian Muslim heritage. The mausoleum features traditional Islamic architectural elements, including domes, arches, and intricate carvings, which reflect the rich cultural blend of Penang's past. Surrounded by a peaceful environment, it serves as both a site of reverence and a historical monument that narrates the story of leadership, unity, and faith of the Indian Muslim community. Visitors to the mausoleum often find it a tranquil space to reflect on Penang's diverse history and multicultural identity.","13, Jln Buckingham, George Town, 10200 George Town, Pulau Pinang",8:00 AM - 6:00 PM,8:30 AM - 5:30 PM,Heritage,Religious,"https://www.google.com/maps/place/Kapitan+Keling+Family+Mausoleum/@5.4163378,100.3337246,17z/data=!3m1!4b1!4m6!3m5!1s0x304ac3a6608116ff:0x3ee4f2b70c2067f3!8m2!3d5.4163325!4d100.3362995!16s%2Fg%2F11fmz8p9rp?entry=ttu&g_ep=EgoyMDI0MTIxMS4wIKXMDSoASAFQAw%3D%3D"
Fort Cornwallis,"homepage/FortCornwallisPenang.jpg","Fort Cornwallis is the largest standing fort in Malaysia, located in George Town, Penang. Built in the late 18th century by the British East India Company, it served as a defensive structure during Penang's early colonial era. The fort, named after Charles Cornwallis, features a star-shaped design and was constructed using bricks and timber, later reinforced with stone. Inside the fort, visitors can explore historical exhibits, cannons, and a small chapel, which offers a glimpse into Penang's colonial past. Overlooking the coastline, Fort Cornwallis stands as a prominent landmark symbolizing Penang's strategic importance as a trading post. Today, it serves as both a tourist attraction and a historical site, drawing visitors eager to learn about Penang's rich colonial heritage and its role in shaping Southeast Asian history.","Jalan Tun Syed Sheh Barakbah, George Town, 10200 George Town, Pulau Pinang",9:00 AM - 6:30 PM,9:00 AM - 6:30 PM,Historical,Landmark,"https://www.google.com/maps/place/Fort+Cornwallis/@5.4204196,100.341974,17z/data=!3m1!4b1!4m6!3m5!1s0x304ac3859e3f8849:0xd4c5c969809e64de!8m2!3d5.4204143!4d100.3445489!16zL20vMDYxeDFu?entry=ttu&g_ep=EgoyMDI0MTIxMS4wIKXMDSoASAFQAw%3D%3D"
Church Street Pier,"homepage/ChurchStreetPier.jpg","Church Street Pier, located along the waterfront of George Town, Penang, is a historic pier that dates back to the late 19th century. Once a bustling hub for maritime activities, it played a key role in Penang's growth as a trading port during the British colonial era. The pier is an architectural gem, featuring colonial-style design elements and intricate ironwork that reflect the craftsmanship of its time. Today, Church Street Pier serves as a scenic spot for locals and tourists alike, offering stunning views of the Straits of Malacca. It is a popular destination for leisurely strolls, photography, and enjoying Penang's rich historical ambiance. With its blend of history and charm, the pier remains an iconic reminder of Penang's maritime heritage.","Georgetown, 10300 George Town, Penang",Open All Day,Open All Day,Historical,Scenic,"https://www.google.com/maps/place/Church+Street+Pier/@5.4166453,100.3415551,17z/data=!3m1!4b1!4m6!3m5!1s0x304ac38ecb458c29:0xe2b8abc57b6df019!8m2!3d5.41664!4d100.34413!16s%2Fg%2F11mbwcjg28?entry=ttu&g_ep=EgoyMDI0MTIxMS4wIKXMDSoASAFQAw%3D%3D"
Catholic Cemetery,"homepage/CatholicCemetery.jpg","The Catholic Cemetery, located in George Town, Penang, is a serene and historical burial ground reflecting the rich heritage of Penang's Catholic community. Dating back to the 19th century, the cemetery is the final resting place for many prominent figures, including missionaries, colonial officials, and early settlers who contributed to the region's development. The site features intricately carved tombstones, crosses, and mausoleums, showcasing a blend of European and local architectural influences. Surrounded by lush greenery, the cemetery serves as a quiet place for reflection and offers insight into the multicultural and multi-religious history of Penang. It is a testament to the enduring legacy of the Catholic faith in the region.","161, Jalan Kelawai, George Town, 10250 George Town, Pulau Pinang",7:00 AM - 7:00 PM,7:00 AM - 7:00 PM,Cemetery,Historical,"https://www.google.com/maps/place/Catholic+Cemetery/@5.4373024,100.3056026,17z/data=!3m1!4b1!4m6!3m5!1s0x304ac303cecdffff:0x188a2a6cbdcbcb94!8m2!3d5.4372971!4d100.3081775!16s%2Fg%2F11gfkjrshb?entry=ttu&g_ep=EgoyMDI0MTIxMS4wIKXMDSoASAFQAw%3D%3D"